Text|Date|URL
di Francesco Battistini I sopravvissuti agli eccidi: «L'impunità è un via libera per nuovi massacri». Lo scrittore Portnikov: ma Putin accetterebbe la pace? DAL NOSTRO INVIATO KIEV - 2.360 chilometri e un sacco di cose dividono Bucha da Ginevra. L'abisso nero della guerra dal bianco delle cime alpine. Domenica mattina, mentre in Svizzera si cominciava a discutere di piani americani ed europei, i sopravvissuti di Bucha entravano nella chiesa di Sant'Andrea Apostolo e non potevano non guardare, come ogni santo giorno dal marzo 2022, la tomba comune proprio di fianco al sagrato, dove ancora non riposano i loro morti. Nelle fosse ardeatine ucraine non si può seppellire così, con un colpo di vanga, il primo grande eccidio ordinato da Vladimir Putin: padre Andrij Halavin, celebrata la messa, è uscito e ha parlato a nome di tutti. Poche frasi, ben scandite. Solenni. Perché le sentissero alla Casa Bianca, al Cremlino, sulle Alpi del Giura e nelle coscienze del mondo: «L'amnistia per i russi che ci hanno massacrato — ha detto — è un via libera. Significa che si può continuare a bombardare, a torturare, a giustiziare. Con la certezza che non accadrà nulla». L'impunità non passa, non qui: «Vogliono il perdono per tutti i crimini di guerra? — l'urlo d'una madre, Vira, 66 anni, che ha perso il figlio Andrij —. È orribile! Lasciateli venire qui! Lasciate che Trump venga qui con la sua famiglia. Vedano il nostro dolore. E forse, allora, cambieranno idea». Ridere piangendo Se è vero che si fa pace dopo aver fatto giustizia, a Bucha i punti dell'accordo potranno essere 28, 26, 19 o mille: è come se valessero zero. Perché si sa chi torturò e uccise. E a Ginevra vogliono che i carnefici, in pace, se ne vadano; che le vittime, in pace, si mettano il cuore. «Stiamo ridendo di questo cosiddetto Piano», è sarcastico M. H., un capitano di brigata che lavora al ministero della Difesa. Ridere piangendo: difficile trovare voci entusiaste. Pure a Kiev, che da Bucha dista 60 km, si è lontani dalle discussioni sui confini, la Nato, gli asset russi, la neutralità. «È solo una trappola politica preparata da Putin», dicono duri i sodali dell'ex presidente ucraino Petro Poroshenko, acceso oppositore di Volodymyr Zelensky: «Ci siamo finiti nel modo peggiore, con un team negoziale imbarazzante. Che ci faceva a Ginevra uno come Andrij Yermak? Molte di quelle proposte sono inaccettabili in entrambe le versioni, europea e americana. Accettarle, significa tradire il mandato. E demolire la fiducia internazionale». In realtà, commenta Korbinian Leo Kramer, columnist del Kyiv Post, non tutto è da buttare e «questa pressione almeno ha coagulato molte simpatie intorno a Zelensky, che ora tenta di rafforzarsi». APPROFONDISCI CON IL PODCAST Però anche Vitalij Portnikov, scrittore molto letto, si sente in trappola: «Sì, ci stanno infilando in una falsa scelta, tra capitolare e arrenderci. Con una discussione sui piani di pace che serve a tutti: chi per non parlare della corruzione, chi per dimostrare che Zelensky è inadeguato, chi solo per dire che non ha più forza e bisogna accettare qualsiasi condizione… Scompare il punto fondamentale: Putin l'accetterebbe, una pace? Sappiamo tutti che non gl'interessa negoziare. A meno che questo non sia un pretesto per continuare la guerra o evitare nuove sanzioni. Se uno è davvero interessato, prima di trattare vuole un cessate il fuoco: si fa così in tutte le guerre. Ma lei la vede, questa volontà?». Scetticismo, dunque: «Questi negoziati faranno la fine del famigerato accordo sulle terre rare. Li stanno conducendo solo perché l'inviato russo Kirill Dmitrev, sperando d'evitare sanzioni sul petrolio, ha messo una bozza idiota sotto il naso dell'inviato americano Steve Witkoff. E perché uno zelante collaboratore di Donald Trump ha portato la bozza in Sala Ovale, per lusingarne la vanità. Appena si parleranno sul serio, Trump e Zelensky, questo accordo fallirà. E non perché non lo firmeranno loro due, ma perché non lo firmerà mai Putin. Uno che si convince alla pace solo quando non può più continuare la guerra: in quel momento, non avrà bisogno di Trump né d'altri, per desiderare una tregua». Ilya Ponomarev, l'unico parlamentare russo che nel 2014 votò alla Duma contro l'annessione della Crimea, conosce bene Putin e concorda: sarà sempre e soltanto lo zar a decidere che cosa, e quando, firmare. Ponomarev è scappato da Mosca, oggi è cittadino ucraino. Con l'aria che tira a Kiev, preferisce starsene in America. «Non mi chieda che cosa penso di quest'accordo», fa il prudente: «Ho capito solo che si sta facendo un sacco di rumore. Ed è un rumore che fa comodo a tutti: a Trump che vuole un risultato, a Putin che vuole prender tempo e pure a Zelensky, che vuole un po' di silenzio sugli scandali».|2025-11-25|https://www.corriere.it/esteri/25_novembre_25/ucraina-piano-di-pace-bucha-546c3c75-a66b-4ec0-83cd-92c958537xlk.shtml
Esistono concetti e marchi che, complice il loro straripante successo commerciale, finiscono per essere indissolubilmente legati all'interno di un binomio univoco nell'immaginario collettivo comune e popolare: lo è stata PlayStation con i videogiochi, Scottex con la carta da cucina e…Windows con i sistemi operativi per personal computer. Alzi la mano chi, vuoi per lavoro o a scuola, non abbia mai avuto a che fare con il sistema operativo di Microsoft. Ben pochi, probabilmente: come una falce che non fa distinzioni e tutto miete, nel corso di quattro decenni Windows ha pressoché toccato ogni generazione, dai baby boomers ai gen-Z di oggi. Di acqua (e bit, tanto per restare in tema) sotto i ponti ne è decisamente passata da quel lontano 20 novembre 1985, data in cui Microsoft lanciò la prima, embrionale versione del suo sistema operativo in quel di Redmond (Stati Uniti). Per celebrare i suoi 40 anni, abbiamo dunque deciso di ripercorrere alcuni dei momenti più salienti di Windows, tra le vertiginose ascese degli anni '90 e gli scivoloni altrettanto ripidi dei primi anni 2000.|2025-11-25|https://www.corriere.it/tecnologia/cards/windows-compie-40-anni-la-storia-del-sistema-operativo-piu-famoso-di-sempre-tra-picchi-e-scivoloni/le-finestre-che-conoscono-tutti_principale.shtml
di Redazione Scuola Sono previste più di 40 aule, oltre a laboratori e officine. Il nuovo edificio di quattro piani, voluto da Ferrari in collaborazione con Fondazione Agnelli e enti locali, verrà inaugurato nel 2029 per il centenario della scuderia Ispirare e formare le future generazioni di innovatori nell'ambito della tecnologia e dell'automotive. E' questo l'obiettivo del nuovo polo educativo che Ferrari ha deciso di progettare a Maranello. Sorgerà nel 2029: si chiamerà M-TECH Alfredo Ferrari e darà vita a un ecosistema di apprendimento continuo, sviluppando un programma di formazione tecnica e professionale che unisce educazione e industria. Un programma che includerà anche una scuola pubblica, che sarà costruita e donata alla comunità. L'ambizione è generare un impatto positivo sul territorio e sull'intero settore dell'automobilismo, attraendo studenti a livello nazionale e internazionale. Il programma formativo e il progetto del nuovo edificio, firmato dallo studio di architettura Labics, sono stati presentati oggi presso la sede del Cavallino Rampante dal Presidente di Ferrari e di Fondazione Agnelli, John Elkann, insieme al Presidente della Regione Emilia-Romagna, Michele de Pascale, al Presidente della Provincia di Modena, Fabio Braglia, e al Sindaco di Maranello, Luigi Zironi. Il finanziamento del complesso è reso possibile da The Ferrari Foundation, una public charity statunitense, impegnata nella creazione di progetti educativi inclusivi. La palestra pubblica verrà realizzata grazie a fondi stanziati dalla Regione Emilia-Romagna. «M-TECH Alfredo Ferrari rappresenta un impegno concreto per il nostro territorio - ha detto Elkann -. Seguendo l'esempio di Enzo Ferrari, che a Maranello fondò una scuola per la formazione tecnica, vogliamo portare avanti la sua visione lungimirante nella convinzione che l'istruzione sia la chiave per costruire un futuro migliore». «L'Emilia-Romagna è terra di motori, innovazione e talento - ha commentato De Pascale -. Formare i nuovi professionisti dell'automotive e delle tecnologie avanzate significa rafforzare la competitività del nostro territorio, attrarre giovani da tutta Italia e dall'estero e proiettarci tra i protagonisti dell'industria dell'innovazione a livello globale». Il nuovo polo offrirà una proposta inclusiva e articolata, dalla scuola secondaria di secondo grado ai percorsi di specializzazione universitaria, fino alla formazione continua per i lavoratori. Gli istituti e i programmi di formazione ospitati al suo interno saranno i seguenti: Istituto tecnico di istruzione superiore «Alfredo Ferrari» di Maranello: scuola pubblica fondata e donata da Enzo Ferrari, oggi frequentata da circa 800 studenti. Le materie spazieranno dalla progettazione CAD alla diagnostica, dalla robotica all'elettronica e all'automazione, includendo inoltre la meccanica sia nelle sue applicazioni più tradizionali sia in quelle più avanzate, come l'additive manufacturing. MUNER (Motor Valley University of Emilia-Romagna): l'associazione svolgerà attività avanzate di progettazione meccanica e simulazione, con workstation di ultima generazione, software professionali e dispositivi per la modellazione CAD/CAM. ITS Maker Academy: corsi post diploma caratterizzati da una didattica laboratoriale avanzata, già oggi ospitati presso l'Istituto A. Ferrari. Corsi di aggiornamento e di riqualificazione professionale: l'offerta formativa continua sarà estesa anche ai tecnici già inseriti nel mondo del lavoro che vogliono accrescere le proprie competenze. La costruzione di M-TECH Alfredo Ferrari prenderà il via all'inizio del 2027 e si concluderà nel 2029, per il centenario della Scuderia Ferrari. Il complesso si estenderà su un'area di 32.000 mq a Maranello, dove prenderà il posto di uno stabilimento in disuso, senza consumo di suolo. Sono previste più di 40 aule, oltre a laboratori e officine, distribuite su quattro piani e organizzate attorno ad aree comuni. Gli spazi comuni prevedono un auditorium, una caffetteria e una biblioteca, accessibili al pubblico per eventi e attività culturali. Attraverso ulteriori interventi, il complesso si arricchirà anche di una palestra pubblica e di una foresteria. Il progetto vincitore rappresenta un esempio di applicazione concreta delle ricerche della Fondazione Agnelli sull'edilizia scolastica, sviluppate attraverso il progetto «Torino fa scuola», il relativo Rapporto di ricerca e le «Linee guida per progettare, costruire e abitare le scuole del futuro», elaborate per le nuove scuole finanziate dal PNRR. L'edificio si ispira a principi educativi innovativi, mirati a favorire una pluralità di approcci didattici e a promuovere il benessere di chi lo abita.|2025-11-25|https://www.corriere.it/scuola/secondaria/25_novembre_19/m-tech-alfredo-ferrari-il-nuovo-polo-educativo-di-maranello-per-i-professionisti-dell-automotive-di-domani-5f4809fd-e473-47d1-b535-80efb631axlk.shtml
di Chiara Maffioletti I due figli di Cristiano Ardenzi, Camilla e Matteo, hanno voluto condividere qualche ricordo personale della nonna Ornella Vanoni Per tutti era un'artista straordinaria, ma per Matteo e Camilla Ardenzi Ornella Vanoni, scomparsa venerdì sera, era, semplicemente, la nonna. Una nonna orgogliosa dei suoi nipoti, li chiamava «i miei tesori», e loro lo erano di lei. Poco più che ventenni, in chiesa, prima del funerale, sono stati loro a stringere le mani e ricevere gli abbracci dei tanti amici della nonna. Quelli di una vita, come Lavezzi o Vecchioni, ma anche i più recenti, perché tra le infinte qualità di questa donna magica, c'è stata anche la capacità di costruire e alimentare relazioni sempre nuove. Camilla, anfibi neri ai piedi e una cascata di lunghi dread biondissimi, e Matteo, in un elegante completo scuro: gli stessi lineamenti e due modi di essere, almeno per quello che si potrebbe pensare osservandoli, molto diversi. Durante la cerimonia sono stati seduti in prima fila vicino al loro papà, Cristiano Ardenzi, unico figlio della cantante, nato nel 1962, che anche nel giorno del suo saluto ha scelto la strada percorsa per tutta la vita, quella del silenzio e della riservatezza. Una scelta forse obbligata dopo che lo spettacolo e la popolarità hanno contribuito a togliergli quello che desiderava di più: la presenza di una madre quando era piccolo. Ieri ha scambiato poche parole, solo con le persone più care. Lo sguardo serio e fiero. È rimasto seduto, vivendo la cerimonia in intimità nonostante la folla. Più volte ha osservato la bara, ricoperta di allegri fiori gialli, il colore preferito della sua mamma. Ma ha lasciato che fossero i suoi figli a dedicare l'ultimo pensiero alla loro nonna. Anzi, nonnina. Il primo a parlare dal pulpito è stato Matteo. Con la voce spezzata dall'emozione l'ha chiamata proprio così: «Nonnina mia, sei stata un'artista grandiosa, una mente irriverente... una persona forte e indipendente». Per lasciare poi spazio al racconto di quello che questa «icona» era per lui e solo per lui: «Quando ero piccolo mi facevi ghirighiri prima di dormire e poi quando ti accompagnavo a qualche evento mi presentavi come il tuo fidanzato, mi facevi ridere così tanto». Emozioni e ricordi: «Nonna mi chiamava ogni giorno per chiedermi come stessi, e rispondeva ai miei messaggi un secondo dopo che avevo già risposto io. Era quella che minacciava di diseredarmi quando fallivo un esame all'università, che mi chiedeva cosa avessi fatto e di Tic Tic (TikTok, ndr)». Spenti i riflettori, scesa dal palco, Vanoni era una nonna affettuosa e attenta, che chiedeva al nipote di raccontarle per filo e per segno anche le sue litigate con la fidanzata: «Mi domandavi: E lei cosa ha risposto? e poi ti sbellicavi». Momenti teneri e vividi, che sono diventati commozione per la consapevolezza che appartengono ormai al passato. «Te ne sei andata senza dirmi nulla. Così, all'improvviso. Ogni tanto mi dicevi: Amore, prima o poi dovrò morire, lo sai, vero? . Ma io, io non ti ho mai creduta davvero. Oggi siamo tutti qui per te, e capisco più che mai come l'essere tuo nipote mi abbia definito come persona e di come l'averti nel mio mondo mi abbia aiutato a scrivere il mio ruolo in questa tragicommedia che è la vita... senza il tuo sguardo da bambina oggi, nel bene e nel male, faccio fatica a immaginare il domani. Ma ci proverò, te lo prometto, a dare sempre il massimo per le persone che amo. Era la cosa che più apprezzavi di me. Ciao nonna. Ti voglio bene e mi manchi». Dopo di lui, ha parlato la sorella. La voce era più ferma, è stata più sintetica, anche se ogni parola è parsa un macigno. «Cara nonna, eri una musa. L'amavamo tutti e tutti volevamo essere amati da lei. Quando mia nonna ti amava il mondo si dipingeva di colori più vivi e quando puntava i fari su di te ti faceva sentire quella sua grandezza dentro, ed eri grande e speciale anche tu. Per questo ,quando questi fari si spegnevano, ne si sentiva la mancanza e ci si sentiva piccoli. Porto una parte di te dentro di me. Grazie per l'amore che mi hai dato, per sempre. Eterna», ha detto. Poi una pausa. E nel silenzio attento della chiesa, la giovane ha recuperato tutto il coraggio del mondo e intonato due versi di Senza fine: la voce come un soffio, la stessa grazia della nonna. Un gesto forte e pieno d'amore che ha emozionato tutti, terminato in un lungo abbraccio tra i fratelli e da un bacio da parte del padre, ma dato solo quando erano tornati a sedersi. Poi Matteo e Cristiano hanno aiutato a portare fuori la bara, Camilla dietro di loro. L'organo ha suonato Ma mi , poi un ultimo lungo applauso a un'artista unica e a una nonna, se possibile, ancora più speciale.|2025-11-25|https://www.corriere.it/spettacoli/25_novembre_25/nipoti-ornella-vanoni-camilla-matteo-ca7bfb40-827a-4e3d-9305-9f250f93fxlk.shtml
di Mara Rodella Finanza al lavoro in cento strutture dal Garda alla Valcamonica Non importa se l'estate è finita (da un po'). Anzi, a maggior ragione, al netto dei periodi ad altissimo flusso di turisti, a non fermarsi sono i controlli della Guardia di Finanza nelle migliaia di strutture ricettive bresciane. Anche sulle base delle segnalazioni istituzionali. Basti considerare che le Partite Iva attive proprio nel comparto turistico, ad oggi, nel Bresciano, rappresentano l'8% del totale, vale a dire circa 13.800 su 173.500. Da agosto, di verifiche ne sono state condotte cento, tra Bed and breakfast, alberghi, affitti brevi, ristoranti e non solo: dal Garda alla Valcamonica, passando per la città. E il bilancio dice di quasi mezzo milione di euro (489.173, calcolatrice alla mano) di tasse non versate al Fisco — oltre a 50 lavoratori in nero e altri 38 irregolari e 8mila certificazioni mancanti dei corrispettivi introitati. Per la precisione: 357.956 euro sono conteggiati tra laghi e Valcamonica, a fronte di 63 controlli (scoperti 13 dipendenti «black» e 10 non regolari), e 131.217 euro tra Brescia e hinterland, dopo 37 accessi (in questo caso i dipendenti totalmente abusivi sono 37 e 28 quelli non in regola). Dieci le attività sospese. La base imponibile sottratta alle casse dello Stato più cospicua — pari a 237.615 euro — è stata accertata dalle Fiamme Gialle tra Moniga e Desenzano (nel mirino due B&B e camping). Segue l'attività del Gruppo delle Fiamme Gialle di Brescia, al lavoro, oltre che nel capoluogo, in altri sedici comuni della provincia, tra hinterland e Franciacorta ma non solo: in questo caso la base imponibile recuperata vale 131.217 euro in 37 tra pizzerie, locali notturni, bar, discoteche e unità ricettive. Dieci attività sono state sospese: oltre il 10% del personale era pagato cash. A Malonno un B&B è risultato abusivo: aveva iniziato a lavorare senza comunicazione preventiva o presentazione della Scia. Tra Salò e Manerba sono stati condotti 46 controlli sulle locazioni brevi, a cui si aggiungono un campeggio e un'agenzia immobiliare (per un totale di 32mila euro non dichiarati e 13 lavoratori in nero): a verbale sono finite 14 mancate — o erronee — esposizioni del Codice identificativo nazionale per le quali sono previste sanzioni da mille euro per ciascuna violazione, ma anche 2 violazioni in materia di imposte di bollo e altrettante di soggiorno evase, oltre a sette casi di mancato pagamento del Canone Rai (che salgono a 23 per quanto riguarda i controlli effettuati dalle Fiamme Gialle di Brescia). I sette tra bar e ristoranti controllati a Iseo e Paratico, invece, hanno restituito, sul totale, 2 lavoratori in nero e 8 irregolari, oltre a una discoteca — a Iseo — risultata abusiva (è stata chiusa su provvedimento del sindaco). Queste recenti attività «confermano l'impegno della Guardia di Finanza nelle prevenzione, individuazione e contrasto di ogni forma di illecito in ambito economico e finanziario, tra cui l'economia sommersa — ribadisce il comandante provinciale delle Fiamme Gialle, Francesco Maceroni — al fine tutelare la competitività delle imprese sul mercato e favorire il benessere e lo sviluppo del Paese».|2025-11-25|https://brescia.corriere.it/notizie/cronaca/25_novembre_25/hotel-b-b-e-ristoranti-sotto-la-lente-mezzo-milione-non-dichiarato-al-fisco-93485166-263e-46a1-ae23-ad271867bxlk.shtml
Nietzsche ci chiede di «restare fedeli alla terra», di non soffocare le esigenze della vita in nome della forma, della cultura, del sapere. Anche perché il sapere della modernità è dissanguato e appare come una forma vuota. Non a caso, è in un aforisma di Al di là del bene e del male che troviamo l'annuncio della morte di Dio. Già Hegel aveva detto che il sentimento fondamentale del mondo moderno è la morte di Dio, ossia la perdita dei fondamenti. E Nietzsche aggiunge che siamo stati noi a uccidere Dio, con il nostro sapere e la nostra volontà di liberarci dalla tradizione. Tuttavia, la morte di Dio fa perdere ogni riferimento all'umano, e dà avvio al processo del nichilismo, alla scomparsa di tutti i valori: l'umano è ormai un sasso che rotola verso il nulla. Per por termine a questo processo non basta la decostruzione dei vecchi pregiudizi: è necessaria la costruzione di nuovi valori. Ed è in questo quadro che l'ultima parte dell'opera di Nietzsche (oltre che, in forma simbolica e metaforica, Così parlò Zarathustra, composto tra il 1883 e il 1885) è dedicata a una ricostruzione o, come Nietzsche propone, a una trasvalutazione di tutti i valori.|2025-11-25|https://www.corriere.it/le-lezioni-del-corriere/filosofia/25_maggio_13/lezioni-del-corriere-filosofia-friedrich-nietzsche.shtml
di Silvia Turin I casi di influenza e infezioni respiratorie acute sono in aumento in gran parte del Paese. Ecco chi dovrebbe vaccinarsi prima che la stagione dei virus entri nel vivo Influenza: tutti i fattori che espongono al rischio di gravi conseguenze di salute / (Getty Images) I virus respiratori si stanno facendo strada come ogni autunno-inverno. Siamo lontani dal picco stagionale, ma proprio per questo è il momento giusto per pensare di vaccinarsi. Ecco perché. Molte persone potranno sperimentare sintomi come mal di gola (anche intenso), naso chiuso, febbre (anche alta) e dolori muscolari che il sistema immunitario riesce a superare nel giro di una settimana; tuttavia, per alcuni individui il virus influenzale aggrava le condizioni già compromesse di pazienti affetti da altre patologie fino a provocarne il decesso. Si arriva così ad attribuire mediamente 8.000 decessi per influenza e le sue complicanze ogni anno in Italia (fonte Istituto Superiore di Sanità). Conoscere chi è più esposto ai rischi di una forma grave della malattia è importante. Ricordando che la vaccinazione è raccomandata a persone over 60 e persone con malattie cronicheo condizioni che indeboliscono il sistema immunitario, chiariamo quali possono essere alcuni dei fattori che espongono a rischio maggiore di gravi conseguenze in caso di influenza. I sette fattori che aggravano -Le persone più vulnerabili includono anziani e bambini molto piccoli, i cui sistemi immunitari sono meno forti rispetto ai giovani adulti, rendendoli meno capaci di contrastare l'influenza. -Anche la prevalenza di determinati tipo di virus influenzali può incidere: quelli di tipo A risultano particolarmente insidiosi, con un'incidenza maggiore di ospedalizzazioni negli ultimi anni, rispetto a quelli di tipo B. -Tra le condizioni croniche a rischio ci sono i disturbi neurologici nei bambini, che compromettono la capacità di respirare e di espellere liquidi dalle vie aeree, facendo aumentare il rischio di polmonite. -Anche le malattie polmonari croniche, come l'asma o la broncopneumopatia ostruttiva, possono peggiorare notevolmente la prognosi e rendere necessario un intervento ospedaliero. -La gravidanza rappresenta un altro momento delicato: gli ormoni che regolano questa fase sopprimono il sistema immunitario, rendendo più facile che l'influenza provochi complicanze sia per la madre sia per il feto. -Un'altra categoria a rischio è quella delle persone obese o affette da malattie metaboliche croniche, dove il sovrappeso e patologie come il diabete possono interferire con la capacità di combattere l'infezione, prolungandone la durata e aggravandone i sintomi. -Non vanno sottovalutate le malattie cardiache: chi soffre di ipertensione o altre patologie cardiovascolari rischia un peggioramento delle condizioni, con una maggiore probabilità di infarto o ictus durante l'influenza. È ora di vaccinarsi Conoscere questi fattori è fondamentale per identificare chi necessita di una maggiore protezione. Anche perché dall'avvenuta somministrazione del vaccino passano 15 giorni perché questo sia totalmente efficace. La campagna vaccinale è ancora all'inizio, ma si ricorda che la tendenza delle coperture è stata in diminuzione nelle ultime stagioni dopo il picco raggiunto nella stagione pandemica 2020-21 con il 65,3% della popolazione anziana (oltre i 65 anni) vaccinato (l'obiettivo sarebbe il 75% della popolazione a rischio): la copertura negli anziani nella stagione influenzale scorsa, in particolare, è diminuita di 0,8 punti percentuali rispetto alla stagione precedente portandosi al 52,5%. La somministrazione è disponibile tramite il Sistema Sanitario Nazionale, ad esempio presso i centri vaccinali, dal medico di base, o nelle farmacie convenzionate. La circolazione virologica in Italia In Italia, nella settimana dal 3 novembre al 9 novembre sono stati427mila i casi stimati di infezioni respiratorie acute (ARI), con un'incidenza totale nella comunità pari a 7,36 casi per 1000 assistiti. L'incidenza più elevata si è osservata nella fascia di età 0-4 anni.|2025-11-25|https://www.corriere.it/salute/malattie_infettive/25_novembre_22/influenza-tutti-i-fattori-che-espongono-al-rischio-di-gravi-conseguenze-per-la-salute-c93544a2-10b0-44af-a7fe-f1a04a611xlk.shtml
