Text|Date|URL
di Manuela Porta Lo psicoterapeuta lancia l'allarme, segnalando un fatto successo alle elementari. «Immagini forti, le bambine hanno vomitato. La sessualizzazione precoce ha conseguenze sulla vita adulta: dobbiamo educare i maschi alle relazioni rispettose, il corpo delle donne non è disposizione del loro piacere» Bambini e club del sesso / (Getty Images) «Per la prima volta mi trovo davanti a una situazione che non so affrontare. Nella nostra scuola ci sono bambini di 9 anni che hanno creato il club del sesso . Chi vuole farne parte è obbligato a visionare materiale pornografico, rapporti orali, a tre, con uso di oggetti. Tutto questo è stato scoperto da una mamma: mi viene da dire maledetti i cellulari e maledetti gli adulti incoscienti che glieli comprano sempre prima. Alcune bambine manifestano disagio forte, oggi una ha vomitato per lo schifo provato davanti a quelle immagini, altre piangono». «Queste sono le parole di una collega che insegna alle elementari, ma sono tante le segnalazioni che mi arrivano da anni, a cadenza quasi settimanale» - spiega Alberto Pellai, psicoterapeuta dell'età evolutiva - «Spesso ricevo mail con richieste d'aiuto in cui un adulto rivela di sentirsi disorientato di fronte a ciò che ha scoperto esistere nella vita virtuale di uno studente o di un figlio. Il mondo digitale dai nostri figli viene gestito in autonomia. E con quell'autonomia, quando sono giovanissimi e inesperti, i nostri figli possono agire danneggiando loro stessi e gli altri: per esempio, facendo sexting, spinti dal desiderio di esplorare attraverso il proprio corpo o il corpo dell'altro ciò che hanno colto della sessualità. Noi specialisti assistiamo frequentemente a comportamenti sessuali in età precoce, motivati dal fatto che bambini e ragazzi sono molto confusi, molto eccitati, molto esplorativi. Si tratta di comportamenti che simulano ciò che accade in un abuso sessuale, anche se agiti tra soggetti di pari età, molto inesperti. Le conseguenze possono essere gravi, con effetti di traumatizzazione e di sessualizzazione precoce. Immagini spinte e pericolose possono avere forti ripercussioni sull'equilibrio psico-fisico dei bambini». Dottor Pellai, davanti a questa allarmante situazione i genitori cosa devono fare? «La prima cosa, la più importante, è che la famiglia smetta di mettere a disposizione in un'età precoce lo smartphone nella logica di aumentare il senso di protezione nei confronti di un figlio, immaginando che quel figlio sia più protetto e sicuro grazie alla geolocalizzazione e alla reperibilità istantanea che lo smartphone offre. Lo ha ribadito negli scorsi giorni anche la Società Italiana di Pediatria nelle sue raccomandazioni sull'uso del digitale: no allo smartphone prima dei 13 anni». I genitori si sentono più tranquilli con un figlio in casa con il telefonino che in giro esposto ai pericoli della vita reale. «Sì, ed è una falsa credenza. La cameretta spesso appare come il luogo più sicuro del mondo, in cui a un figlio non può accadere nulla di avverso. Questo atteggiamento è tipico di quei genitori molto preoccupati dell'incolumità fisica, ma che non si rendono conto che oggi ciò che più necessita di essere tutelato è l'incolumità psicologica. Come racconto nel mio ultimo libro, Esci da quella stanza, scritto con Barbara Tamborini, i rischi per i nostri figli non sono fuori nel mondo, ma dentro alle loro stanze, perché è proprio lì che può accadere di tutto e che tutti i limiti possono essere trasgrediti se il genitore non offre un accompagnamento e una supervisione della vita digitale di un minore, oggi più che mai necessaria». I pericoli arrivano dal digitale o anche ciò che una famiglia dice, o non dice, ha un peso? «A casa tutto ciò che ha a che fare con la sessualità resta ancora vincolato al codice del silenzio, rimanendo una questione di parole non dette . E questo silenzio aumenta la vulnerabilità dei figli, poiché nessun bambino – se mai si imbatte in situazioni connotate sessualmente che lo fanno sentire disorientato o a disagio – si sente capace di parlarne con un genitore che gli ha imposto il silenzio in questo ambito educativo». Siamo stati tutti esplorativi, crescendo, rispetto alla sessualità. «Sì, ma un tempo questa esploratività veniva a contatto con strumenti che offrivano risposte e immagini limitate. Oggi, invece, i bambini, facendo una semplice domanda a un motore di ricerca, si possono trovare con pochi clic a navigare in un sito pornografico. Le ricerche dicono che la metà delle prime incursioni di un minore in un sito pornografico sono il frutto della casualità e di una proposta di navigazione che il bambino riceve dall'online senza averla cercata. La sessualità è disseminata ovunque. Così, mentre la famiglia transenna tutto ciò che ha a che fare con il sesso trattandolo come un tabù, i nostri figli hanno accesso a un mondo virtuale che spalanca la porta a qualsiasi tipo di rappresentazione. Il dialogo tra genitori, educatori e minori oggi è più che mai fondamentale per aiutarli a capire che esiste una differenza enorme tra il sesso mostrato dalla pornografia e fare l'amore». Quali le ripercussioni a livello fisico e psicologico? «I bambini che vengono sollecitati sul fronte della sessualità possono diventare portatori di comportamenti di sessualizzazione precoce, poiché tutto ciò che vedono e assorbono non ha modo di essere metabolizzato e integrato in modo adeguato nei loro funzionamenti mentali, ancora immaturi. Sperare che il bambino sappia autolimitarsi quando entra a contatto con la pornografia è impossibile, soprattutto nel passaggio tra infanzia e preadolescenza, momento in cui la ricerca di eccitazione e sensazioni intense è particolarmente acceso. Quando in una classe, o in famiglia, si verificano comportamenti sessualizzati in età precoce è importante che si intervenga subito con azioni di natura educativa e preventiva, aiutando i più piccoli a comprendere il valore dei confini corporei, aspetto che tra l'altro è di importanza fondamentale per la prevenzione degli abusi sessuali sui minori. Inoltre, se un bambino si trova coinvolto in qualcosa che precocizza il suo ingresso nel mondo della sessualità, ne può derivare un trauma: la sua mente, raggiunta e pervasa da immagini ad alto impatto emotivo, può trovarsi in balia di qualcosa che non sa come metabolizzare e risolvere e quindi può produrre sintomi come mal di pancia, mal di testa, vomito». Come agire? «Tutti noi professionisti, insegnanti e genitori dovremmo intervenire aiutando i bambini a dare senso a ciò che la mente fa per difendersi da ci che ritiene inadeguato o pericoloso per il proprio equilibrio. Se il tuo cervello ti fa provare disgusto, fino a darti la sensazione di nausea, sta cercando di farti comprendere che la sessualità – che è una delle cose più belle che abbiamo a disposizione nella vita – è entrata nel tuo campo di esperienza dalla porta sbagliata. Se qualcuno ti ha forzato a vedere immagini o se tu stesso ti sei trovato a contatto con esperienze o immagini sessuali che ti hanno provocato disagio, significa che devi imparare a dire no, ad allontanarti da quelle immagini ed esperienze e a chiedere aiuto ad un adulto di riferimento. Perché nessun bambino deve permettere che una cosa bella entri invece nella vita di qualcuno in modo brutto e distorto, procurando dolore e disagio. È bene aiutare il bambino a comprendere che i sintomi che produce il nostro cervello sono difensivi, e alla luce di questa consapevolezza i bambini possono essere aiutati ad autodeterminarsi e a opporsi a quelle esperienze». APPROFONDISCI CON IL PODCAST Che conseguenze potrebbe avere nel rapporto futuro con le donne? «Il corpo femminile diventa un oggetto a disposizione del piacere maschile e l'abitudine sempre più precoce dei figli maschi di imparare norme sociali e attitudini verso la sessualità all'interno della pornografia è qualcosa che contrasta con il messaggio di prevenzione che invece noi abbiniamo a ogni esperienza educativa relativa alla prevenzione della violenza di genere». Gli ultimi dati Istat lanciano l'allarme: l'aumento della violenza contro le ragazze tra i 16 e i 24 anni, spesso da parte di un ex compagno, dimostra che una parte di giovani maschi rimane ancorata alla cultura del possesso sul corpo femminile. «È fondamentale educare i nostri figli a relazioni rispettose, rispetto ed empatia devono diventare delle competenze su cui noi genitori dobbiamo puntare, in modo che sia sempre parte integrante della loro vita, anche nei comportamenti sessuali con i loro partner». Ha senso, oggi, rimettere nella vita dei bambini e delle bambine anche valori come il rispetto per sé stessi e gli altri? «Dobbiamo favorire in tutti i modi la relazionalità vera , quella con l'amico del cuore, con il ragazzo o la ragazza che ti fa battere il cuore, con il gruppo dei pari con cui sperimenti l'appartenenza a qualcosa che ha caratteristiche totalmente diverse dalla qualità di relazione e dalle esperienze che vivi con mamma e papà e più in generale all'interno dei legami familiari. Purtroppo il mercato molto aggressivo, e una notevole inconsapevolezza di noi genitori, ha sdoganato nella vita dei minori strumenti potentissimi che li hanno allontanati dai compiti evolutivi che da sempre chi cresce deve imparare ad assolvere e li hanno immersi in un modo adultizzato dove tutto viene precocizzato e stimolato con modalità non fase-specifiche. L'aggressività con cui le piattaforme digitali entrano nella vita dei nostri figli non è solo un problema educativo, ma un vero e proprio problema di sanità pubblica. E in tutto questo, la mancanza totale di educazione affettiva e sessuale lascia i piccoli esposti a situazioni estreme ed eccitanti che non sanno gestire e che spesso li tengono in ostaggio». Per ricevere tutti gli aggiornamenti sul mondo di Figli&Genitori iscrivetevi alla newsletter di Figli&Genitori|2025-11-25|https://www.corriere.it/salute/figli-genitori/25_novembre_25/bambini-e-pornografia-alberto-pellai-club-del-sesso-a-9-anni-sul-telefonino-5f7a6cbf-a7d2-44d2-a4ff-7a97fd4fcxlk.shtml
di Valentina Baldisserri Chieti, il padre dei bambini in silenzio dopo una riunione dei neo rurali. Il vicino: «Mi viene da piangere, che ne sanno i giudici» Gli animali soli nel buio e il papà che non torna. «Sta male dalla rabbia» / La «famiglia del bosco» Dlla nostra inviata a Chieti «Quanti terremoti potenti ci sono stati qui in Abruzzo? Almeno due no? Mi dite come mai quel casolare non è mai crollato se è fatiscente, se non è stabile come dicono?». Osvaldo, è un abruzzese di quelli tosti, parla in dialetto per rafforzare i concetti. Nelle campagne di Palmoli ci è nato e ci vive. Ma è arrabbiato, ce l'ha con il mondo intero, anche un po' con i giornalisti («Forse non è un bene che siate qui») per via della storia che ha travolto i suoi vicini di casa Nathan e Catherine: «Cosa ne sanno i giudici della vita qui? Perché non vengono a vedere come siamo messi, con le strade dissestate, abbandonati dalle istituzioni?». Poi di colpo l'espressione burbera si trasforma in commozione: «Se penso a quei bambini portati via così mi viene da piangere. Perché io a quella famiglia voglio bene. A ogni Natale Catherine mi portava la torta di cioccolata che preparava. Lui mi dava una mano se serviva. I loro figli? Per me sono come i miei nipoti. Sempre sorridenti, felici. Prima qui c'era allegria, ora solo tristezza». Osvaldo se la prende pure con i social che «Raccontano fandonie. Devono lasciarli in pace». Poi se ne va brontolando. Il gelo Il freddo è pungente qui in contrada Mondola, il silenzio pesante. Non c'è nessuno nel casolare in pietra sulla strada che va a Palmoli. Un via via di telecamere e inviati, quelli sì. Tutti che attendono Nathan davanti al cancello in legno che sbarra l'ingresso. Gallipoli e Lee, l'asinello e il cavallo di proprietà della famiglia che vive nel bosco, vagano nervosi nel pezzo di bosco antistante la casa. Sembrano aver capito che la situazione è complicata, che forse i bambini, compagni di gioco, non torneranno tanto presto. Aspettano anche loro Nathan che fino a tarda sera però non rientrerà. «Si è rifugiato da amici a Chieti» ci dicono. Qualcuno sussurra che non sta bene questo papà rimasto solo, separato dai tre figli e dalla moglie Catherine. «Domenica notte si è sentito male, sarà la rabbia per gli ultimi avvenimenti», dice un amico. Niente interviste Niente più dichiarazioni. Nathan si è chiuso in una specie di silenzio stampa. Pare che ci sia stata una riunione delle comunità neo rurali che vivono lì intorno e che condividono la stessa filosofia di vita della famiglia anglo-australiana. E che abbiano deciso loro per lui. Silenzio da ora in poi: «Perché il clamore mediatico degli ultimi giorni potrebbe danneggiare la famiglia anziché aiutarla». In paese invece se ne parla eccome di questa storia che ha portato Palmoli, 850 abitanti circa a 7o0 metri di altitudine, sulle prime pagine di giornali e tv. Qualcuno è annoiato dalle domande dei giornalisti e protesta per l'invasione. La fruttivendola Ermelinda no. Lei racconta. Di questa famiglia «che non parlava bene l'italiano» e che «non si vedeva tanto spesso in paese. Catherine non dava tanta confidenza. Entrava in negozio e prendeva pane, frutta. I bimbi belli ed educati.Dispiace li abbiano allontanati dai genitori. Però — dice storcendo la bocca a mo' di critica — avrebbero dovuto accettare l'aiuto che gli aveva offerto il Comune. Potevano avere una casa qui, in paese. E poi nel weekend tornarsene nel bosco. Cosi invece hanno perso tutto». «Non è tutto perso» ribatte a distanza l'avvocato Giovanni Angelucci che continua la sua battaglia per riportare a casa Catherine e i tre bimbi. Nel ricorso che dovrà presentare tra pochi giorni, cercherà di rispondere punto per punto alle criticità espresse nel decreto del tribunale dell'Aquila. Una di queste è il bagno a secco posto all'esterno del casolare. I lavori Ieri Nathan ha firmato il progetto di ristrutturazione che servirà a costruire un nuovo bagno in casa, che garantisca condizioni igieniche migliori. È un primo passo, non sarà l'ultimo. Perché i giudici rivedano le loro decisioni, serve che i due genitori si ammorbidiscano su altri fronti, vedi l'istruzione. «Però non dite che l'istruzione parentale porta all'isolamento dei minori — dice Annalisa Vincenzi, vice segretaria Laif, l'Associazione istruzione in famiglia —. Ho due figli che come quelli di Nathan e Catherine, seguono l'unschooling. E non sono affatto isolati e asociali. E conosco bene Nathan e Catherine, due genitori bravissimi. Spero che i giudici lo capiscano». Del resto in questa storia che appassiona l'Italia e fa discutere, non c'è un solo punto di vista che vince. Intanto la petizione online ha superato le 150 mila firme.|2025-11-25|https://www.corriere.it/cronache/25_novembre_25/famiglia-bosco-chieti-padre-nathan-bambini-a286fd09-62d8-495e-91ab-d4412b5afxlk.shtml
Dalle strade ai luoghi delle istituzioni, oggi più che mai Palermo alza la testa e dice no alla violenza sulle donne. Lo fa con le luci che illuminano i Palazzi, con dibattiti e testimonianze drammatiche, come quella di Maria Concetta Zaccaria, la mamma di Sara Campanella, la studentessa uccisa a Messina da un coetaneo, e con il corteo di Non una di Meno che intende riportare la lotta su questi temi per le vie della città, rendendola zona fucsia per un giorno, in polemica con quelle rosse volute dall'amministrazione cittadina. Sono tante le iniziative che anche quest'anno animeranno una giornata di lotta simbolica, ma con lo spirito che ogni giorno dell'anno sia quello giusto per combattere ogni forma di abuso. La violenza, infatti, non è solo fisica. Un messaggio che ha animato anche l'iniziativa del violenzometro , lo strumento che da oggi viene distribuito nelle scuole superiori di Palermo per aiutare gli studenti a capire che la violenza può manifestarsi anche in forme e comportamenti diversi da quella fisica. Alcune iniziative di oggi vogliono abbattere i muri della marginalità e dell'isolamento, come quella che alle 9,30 porta nella sezione femminile del carcere Pagliarelli la rappresentazione de Lo stupro , il celebre monologo di Franca Rame. L'iniziativa resa possibile da Assostampa, Cetec di Milano e dal garante dei detenuti di Palermo, Pino Apprendi, con la partecipazione delle attrici della Casa museo Alda Merini di Milano Donatella Massimilla e Gilberta Crispino, si replica alle 11 ai Cantieri culturali alla Zisa in occasione dell'inaugurazione delle Panchine rosse , un simbolo, sì, ma permanente. Esponenti del mondo della giustizia, della psicologia e del sociale si incontrano oggi alle 9 all'aula magna della Pontificia Facoltà Teologica di Sicilia, mentre allo Steri, sede del rettorato dell'università, alle 15.30, si tiene un incontro per fare rete contro la violenza di genere. Tanti i dibattiti dentro le scuole: all'istituto Falcone di Palermo, allo Zen, si discute di violenza sulle donne insieme agli assessori Alaimo e Ferrandelli, proprio in un quartiere che spesso viene lasciato solo e ghettizzato all'indomani dei fatti di cronaca. L'educazione all'affettività nelle scuole è, invece, al centro dell'incontro che si tiene alle ore 16, all'Istituto Comprensivo Statale Sperone-Pertini, mentre si discuterà nei prossimi giorni, il 10 dicembre, di empatia nelle relazioni digitali e di prevenzione delle molestie online, al liceo Danilo Dolci , all'interno di uno degli hub del Progetto Rete di Invitalia, dedicati ai temi del femminile, al via oggi in tutta Italia. Al Tribunale di Palermo, alle 11, vengono inaugurate due stanze per l'ascolto protetto per accogliere e proteggere donne vittime di violenza o vulnerabili. I femminicidi che riempiono le pagine dei giornali, quando si spengono i riflettori, nella vita delle famiglie, lasciano dolore e silenzio. Vuole essere quindi un'iniziativa per non dimenticare il convegno previsto alle ore 15 all'Ars a cui partecipa la mamma di Sara Campanella, la studentessa dell'Università di Messina uccisa da Stefano Argentino, ma anche uno spazio di confronto su come la violenza sulle donne stia assumendo oggi forme nuove e non immediatamente riconoscibili. Sempre nel pomeriggio, anche a Palermo, davanti al Politeama, alle 17 si riunisce il corteo di Non Una di Meno che attraversa le vie del centro e che intende restituire luce non solo sui grossi numeri, ma anche su quel quotidiano sommerso, strutturale e normalizzato di cui è fatta la violenza di genere. Ecco perché la mobilitazione deve riguardare ogni ambito, e attraversa anche l'arte e la musica. Oggi si inaugura la mostra Com'eri vestita? , a Palazzo Conti Pilo di Capaci, mentre l'iniziativa del Brass Group chiude la giornata tingendo di rosso il Blue Brass — Ridotto dello Spasimo. Lo fa con Palco rosso , un esperimento di palco condiviso, dove musica e parola diventano strumenti di resistenza culturale, un antidoto alla violenza. E al silenzio che spesso la accompagna.|2025-11-25|https://palermo.repubblica.it/cronaca/2025/11/25/news/violenza_donne_corteo_dibattiti_eventi_palermo-425002761/
di Paolo Foschi Campania e Puglia al centrosinistra. Il Veneto al centrodestra: Carroccio al 36%, FdI al 18,7% Il centrosinistra mantiene la guida di Puglia e Campania, il centrodestra si conferma in Veneto: 2-1, questo il risultato dell'ultima tornata elettorale, esattamente speculare a quello segnato nelle scorse settimane dai partiti della maggioranza di governo che avevano vinto nelle Marche e in Calabria e perso in Toscana. Le regionali di autunno si chiudono quindi in parità. Ancora in calo l'affluenza: 43,6% il dato medio (5 anni fa era al 57,6%), con la Puglia al 41,8% (56,4% nel 2020), la Campania al 44,1% (55,5%) e il Veneto al 44,6% (61,2%). Non cambia quindi la bandiera issata sulle regioni al voto. Nel dettaglio, in Campania, finita l'era De Luca, l'asse 5 Stelle-Pd, dato favorito dai sondaggisti, ha respinto il tentativo di rimonta del centrodestra: il pentastellato Roberto Fico, ex presidente della Camera, si è imposto con il 60,7% dei voti, mentre il generale Edmondo Cirielli, esponente di spicco di FdI e viceministro degli Esteri, si è fermato al 35,6%. L'appoggio convinto della premier non è dunque riuscito a ribaltare la situazione: la lista Giorgia Meloni per Cirielli-FdI ha ottenuto un deludente 11,8%, Forza Italia il 10,9%, la Lega il 5,5%. Sul fronte opposto Pd al 18,7%, M5S al 9,2%, Casa riformista al 5,9% e Avs al 4,6%. Bene le liste civiche, con A testa alta all'8%. In Veneto il centrodestra ha dominato il voto con Alberto Stefani, 33 anni, vicesegretario leghista: con il 64,4% raccoglie l'eredità di Luca Zaia, mentre Giovanni Manildo, Pd, si è fermato al 28,9%. Il medico no vax Riccardo Szumski, che ha fatto un campagna elettorale contro la destra e contro la sinistra ha preso più del 5%. Nel derby interno al centrodestra, la Lega, grazie anche al traino del governatore uscente Luca Zaia, ha superato il 36%, con FdI al 18,7% e Forza Italia al 6,3%. Tutto secondo le previsioni anche in Puglia: Antonio Decaro, europarlamentare Pd con record di preferenze al Sud e apprezzato ex sindaco di Bari, è volato al 64,1%, lasciando al 35% l'imprenditore Luigi Lobuono, centrodestra, già candidato sindaco a Bari nel 2004 sconfitto da Michele Emiliano, oggi governatore uscente. Il Pd ha incassato il 25,9%, nonostante l'erosione di voti da parte delle liste civiche (Decaro presidente al 12,7% e Per la Puglia all'8,6%). Il Movimento 5 Stelle ha preso poco più del 7%. Dall'altra parte, FdI al 18,7%, Forza Italia sopra il 9% e la Lega all'8%. APPROFONDISCI CON IL PODCAST «Uniti si stravince, la vera sconfitta di oggi è Giorgia Meloni»: questo il commento di Elly Schlein, segretaria del Pd. Per la premier Giorgia Meloni, invece, la vittoria di Stefani «è il frutto della credibilità del centrodestra». «I risultati di Campania e Puglia, dopo la Toscana, dicono invece che l'alternativa c'è, da casa riformista fino alla sinistra. E questa alternativa, quando è unita, vince» ha commentato Matteo Renzi, Italia Viva. Secondo Giuseppe Conte, in Campania «ha vinto chi non si è rivoltato dall'altra parte di fronte alle difficoltà di famiglie e imprese, chi non dice che va tutto bene, chi ha saputo ascoltare». Per Antonio Tajani, Forza Italia, «la situazione rimane quella che era prima, con tre regioni dove la sinistra si è confermata e tre regioni dove il centrodestra si è confermato. In più la Val d'Aosta, dove Forza Italia è entrata al governo e ha sostituito il Pd. Quindi diciamo è finita 4 a 3». Matteo Salvini ha invece commentato con orgoglio il successo in Veneto: «Vince la squadra». La newsletter Diario Politico Se vuoi restare aggiornato sulle notizie di politica iscriviti alla newsletter Diario Politico . E' dedicata agli abbonati al Corriere della Sera e arriva due volte alla settimana alle 12. Basta cliccare qui.|2025-11-25|https://www.corriere.it/politica/25_novembre_25/elezioni-regionali-campania-puglia-veneto-risultati-definitivi-6011382c-df3c-4a40-a71d-7fdc3cd61xlk.shtml
